topic,source,bias,url,title,date,authors,content,content_original,source_url,bias_text,ID
trade,The Hill,1,http://thehill.com/policy/finance/382020-trade-war-fears-escalate-as-trump-ups-ante,Trade war fears escalate as Trump ups ante,2018-04-06,,"Markets dropped precipitously on Friday amid fears of a growing trade war between the United States and China .
The Dow Jones Industrial Average fell more than 700 points as White House press secretary Sarah Huckabee Sanders insisted years of Chinese policies were to blame for the tit-for-tat tariffs imposed by the world ’ s largest two economies against one another were .
The Dow recovered slightly before the end of the trading end , falling 572 points .
Trump administration officials insisted there was no trade war even as trade groups in Washington and GOP lawmakers expressed alarm at the back and forth .
“ We are not in a trade war , ” insisted White House chief economic advisor Larry Kudlow , who before joining the administration served as a longtime CNBC host and was seen as a free-trade advocate .
“ What this is is an attempt to right some of the wrongs with respect to China , ” he said .
The sense that the trade war was intensifying mounted Thursday when President Trump Donald John TrumpFederal judge halts California law targeting Trump tax returns Trump agriculture chief : No guarantee small farms can survive Harris presses Twitter to 'do something ' over Trump 's 'coup ' tweet MORE surprised observers by announcing a possible expansion of U.S. tariffs on Chinese goods by $ 100 billion . Trump had previously announced $ 50 billion in tariffs on Chinese goods as a response to intellectual property concerns in China , and $ 3 billion in tariffs on aluminum and steel imports .
“ It makes us nervous , for sure , ” said Aaron Low , senior vice president of regulatory and government affairs at the Auto Care Association , a group that advocates on behalf of the auto repair industry .
China has already announced retaliation for the first $ 53 billion in U.S. tariffs , and could be expected to respond to the next $ 100 billion if it is implemented — though this would nearly equal total U.S. exports to China .
American Chemistry Council ( ACC ) President and CEO Cal Dooley , a former Democratic congressman from California , said the tariffs amounted to misguided economic policy .
“ When we have the administration implementing import tariffs primarily targeted at some of the less competitive industries , what we ’ re seeing is retaliation against the most competitive industries , the ones that are growing and creating jobs , ” he said .
Republicans have scrambled to find a middle ground between Trump ’ s aggressive trade sense , which is opposed to the party ’ s free trade orthodoxy , and supporting the president who is still popular among the party ’ s base .
“ This is not the way I would do it , throw the hand grenade in the middle of the room and count the bodies , ” he said Rep. Bill Flores William ( Bill ) Hose FloresHere are the lawmakers who are n't seeking reelection in 2020 Trump calls on House Republicans to let committee chairs stay on the job longer Wave of GOP retirements threatens 2020 comeback MORE ( R-Texas ) in an interview for WTAW radio . “ But it ’ s working , ” he added .
Others have been more critical . Senate Finance Committee Chairman Orrin Hatch Orrin Grant HatchTrump to award racing legend Roger Penske with Presidential Medal of Freedom Trump awards Presidential Medal of Freedom to economist , former Reagan adviser Arthur Laffer Second ex-Senate staffer charged in aiding doxxing of GOP senators MORE ( R-Utah ) said that while the U.S. needed to address trade challenges head on , “ we can not exacerbate these challenges with self-inflicted harm . ”
The expanding list of potential tariffs is opening the possibility that China would find new ways to strike back at the U.S .
China only imported $ 130 billion-worth of American goods in 2017 , according to the U.S. Census Bureau . As a result , if Trump expands his tariff list to $ 150 billion , China would not be able to match the threat using tariffs alone .
“ We could see complications arise in terms of foreign exchange and the Chinese currency reaction , plus the possibility of China selling off some of its treasury holdings . That has negative growth implications , ” said Goldman Sachs chief U.S. political economist Alec Phillips .
By making its currency artificially cheap , as it has done in the past , China could lower the dollar price of both Chinese goods and American tariffs , while making American goods more expensive for Chinese consumers .
If the country decides to sell off some of its massive collection of U.S. debt , a move that likely would be seen as a major escalation , China could tighten the financial market in the U.S. , though it would risk lowering the value of the remaining American debt it owns .
The Asian giant could also seek to make it difficult for U.S. financial , travel and other services industries to operate in China . The U.S. has a $ 38 billion trade surplus in services .
China has criticized Trump for the sanctions , and has sought to close ranks with the European Union , which has also criticized Trump over steel and aluminum tariffs imposed on imports around the globe .
“ China and the EU ... should take a clear stance against protectionism , jointly preserve the rules-based multilateral trade order , and keep the global economy on a sound and sustainable track , ” said Zhang Ming , the head of the Chinese mission to the EU , according to AFP .
According to the report , European Commission spokesman Daniel Rosario only reiterated the belief that “ free and fair trade is one of the most powerful engines for growth , supporting millions of jobs and contributing to prosperity . ”","Markets dropped precipitously on Friday amid fears of a growing trade war between the United States and China.

The Dow Jones Industrial Average fell more than 700 points as White House press secretary Sarah Huckabee Sanders insisted years of Chinese policies were to blame for the tit-for-tat tariffs imposed by the world’s largest two economies against one another were.

The Dow recovered slightly before the end of the trading end, falling 572 points.

Trump administration officials insisted there was no trade war even as trade groups in Washington and GOP lawmakers expressed alarm at the back and forth.

ADVERTISEMENT

“We are not in a trade war,” insisted White House chief economic advisor Larry Kudlow, who before joining the administration served as a longtime CNBC host and was seen as a free-trade advocate.

“What this is is an attempt to right some of the wrongs with respect to China,” he said.

The sense that the trade war was intensifying mounted Thursday when President Trump Donald John TrumpFederal judge halts California law targeting Trump tax returns Trump agriculture chief: No guarantee small farms can survive Harris presses Twitter to 'do something' over Trump's 'coup' tweet MORE surprised observers by announcing a possible expansion of U.S. tariffs on Chinese goods by $100 billion. Trump had previously announced $50 billion in tariffs on Chinese goods as a response to intellectual property concerns in China, and $3 billion in tariffs on aluminum and steel imports.

“It makes us nervous, for sure,” said Aaron Low, senior vice president of regulatory and government affairs at the Auto Care Association, a group that advocates on behalf of the auto repair industry.

China has already announced retaliation for the first $53 billion in U.S. tariffs, and could be expected to respond to the next $100 billion if it is implemented — though this would nearly equal total U.S. exports to China.

American Chemistry Council (ACC) President and CEO Cal Dooley, a former Democratic congressman from California, said the tariffs amounted to misguided economic policy.

“When we have the administration implementing import tariffs primarily targeted at some of the less competitive industries, what we’re seeing is retaliation against the most competitive industries, the ones that are growing and creating jobs,” he said.

Republicans have scrambled to find a middle ground between Trump’s aggressive trade sense, which is opposed to the party’s free trade orthodoxy, and supporting the president who is still popular among the party’s base.

“This is not the way I would do it, throw the hand grenade in the middle of the room and count the bodies,” he said Rep. Bill Flores William (Bill) Hose FloresHere are the lawmakers who aren't seeking reelection in 2020 Trump calls on House Republicans to let committee chairs stay on the job longer Wave of GOP retirements threatens 2020 comeback MORE (R-Texas) in an interview for WTAW radio. “But it’s working,” he added.

Others have been more critical. Senate Finance Committee Chairman Orrin Hatch Orrin Grant HatchTrump to award racing legend Roger Penske with Presidential Medal of Freedom Trump awards Presidential Medal of Freedom to economist, former Reagan adviser Arthur Laffer Second ex-Senate staffer charged in aiding doxxing of GOP senators MORE (R-Utah) said that while the U.S. needed to address trade challenges head on, “we cannot exacerbate these challenges with self-inflicted harm.”

The expanding list of potential tariffs is opening the possibility that China would find new ways to strike back at the U.S.

China only imported $130 billion-worth of American goods in 2017, according to the U.S. Census Bureau. As a result, if Trump expands his tariff list to $150 billion, China would not be able to match the threat using tariffs alone.

“We could see complications arise in terms of foreign exchange and the Chinese currency reaction, plus the possibility of China selling off some of its treasury holdings. That has negative growth implications,” said Goldman Sachs chief U.S. political economist Alec Phillips.

By making its currency artificially cheap, as it has done in the past, China could lower the dollar price of both Chinese goods and American tariffs, while making American goods more expensive for Chinese consumers.

If the country decides to sell off some of its massive collection of U.S. debt, a move that likely would be seen as a major escalation, China could tighten the financial market in the U.S., though it would risk lowering the value of the remaining American debt it owns.

The Asian giant could also seek to make it difficult for U.S. financial, travel and other services industries to operate in China. The U.S. has a $38 billion trade surplus in services.

China has criticized Trump for the sanctions, and has sought to close ranks with the European Union, which has also criticized Trump over steel and aluminum tariffs imposed on imports around the globe.

“China and the EU... should take a clear stance against protectionism, jointly preserve the rules-based multilateral trade order, and keep the global economy on a sound and sustainable track,” said Zhang Ming, the head of the Chinese mission to the EU, according to AFP.

According to the report, European Commission spokesman Daniel Rosario only reiterated the belief that “free and fair trade is one of the most powerful engines for growth, supporting millions of jobs and contributing to prosperity.”",www.thehill.com,center,oZgL54mLNQKyukjA
trade,New York Times - News,0,https://www.nytimes.com/2018/08/27/us/politics/us-mexico-nafta-deal.html?action=click&module=Top%20Stories&pgtype=Homepage,U.S. and Mexico Agree to Preliminary Nafta Deal,2018-08-27,"Ana Swanson, Katie Rogers, Alan Rappeport","Under the changes agreed to by Mexico and the United States , car companies would be required to manufacture at least 75 percent of an automobile ’ s value in North America under the new rules , up from 62.5 percent , to qualify for Nafta ’ s zero tariffs . They will also be required to use more local steel , aluminum and auto parts , and have 40 to 45 percent of the car made by workers earning at least $ 16 an hour , a boon to both the United States and Canada and a win for labor unions , which have been among Nafta ’ s biggest critics .
“ Automakers urge the U.S. and Mexico to quickly re-engage with Canada to continue to build on this progress , ” the Alliance of Auto Manufacturers , which represents most carmakers that sell vehicles in the United States , said in a statement . “ The industry is hopeful that any changes to Nafta auto rules of origin continue to strike the right balance by incentivizing production and investment in North America while keeping new vehicles affordable for more Americans . ”
In a briefing Monday , administration officials said the United States and Mexico had also reached an agreement over a “ sunset clause , ” proposed by the Trump administration , that would cause Nafta to automatically expire unless the three countries voted to extend it .
The two countries agreed to a review of the trade pact every six years that would extend its lifetime for 16 more years , officials said . That longer time horizon would give lawmakers a chance to review the pact ’ s progress , while giving businesses certainty for the near future .
The countries also agreed to limit the kinds of legal challenges that investors can make against foreign governments under Nafta . The oil and gas , infrastructure , energy generation and telecom industries are exempted from these more restrictive rules , and will operate under the previous terms , Mr. Lighthizer said — a win for those industries .
One contentious issue that remains unresolved is whether the administration will exempt Mexico from its steel and aluminum tariffs . Mr. Trump hit Mexico , along with Canada , the European Union and other nations , with 25 percent tariffs on steel and 10 percent tariffs on aluminum , in part to force concessions on other trade issues . Mexican officials said they expected the tariffs to be addressed down the road .
“ I don ’ t think it was necessary to address them now , ” Mr. Videgaray said . “ We ’ d like those to be addressed alongside Canada . It would be great if we could have a trilateral agreement on lifting those and our retaliatory tariffs on U.S. goods . ”","Under the changes agreed to by Mexico and the United States, car companies would be required to manufacture at least 75 percent of an automobile’s value in North America under the new rules, up from 62.5 percent, to qualify for Nafta’s zero tariffs. They will also be required to use more local steel, aluminum and auto parts, and have 40 to 45 percent of the car made by workers earning at least $16 an hour, a boon to both the United States and Canada and a win for labor unions, which have been among Nafta’s biggest critics.

“Automakers urge the U.S. and Mexico to quickly re-engage with Canada to continue to build on this progress,” the Alliance of Auto Manufacturers, which represents most carmakers that sell vehicles in the United States, said in a statement. “The industry is hopeful that any changes to Nafta auto rules of origin continue to strike the right balance by incentivizing production and investment in North America while keeping new vehicles affordable for more Americans.”

In a briefing Monday, administration officials said the United States and Mexico had also reached an agreement over a “sunset clause,” proposed by the Trump administration, that would cause Nafta to automatically expire unless the three countries voted to extend it.

The two countries agreed to a review of the trade pact every six years that would extend its lifetime for 16 more years, officials said. That longer time horizon would give lawmakers a chance to review the pact’s progress, while giving businesses certainty for the near future.

The countries also agreed to limit the kinds of legal challenges that investors can make against foreign governments under Nafta. The oil and gas, infrastructure, energy generation and telecom industries are exempted from these more restrictive rules, and will operate under the previous terms, Mr. Lighthizer said — a win for those industries.

One contentious issue that remains unresolved is whether the administration will exempt Mexico from its steel and aluminum tariffs. Mr. Trump hit Mexico, along with Canada, the European Union and other nations, with 25 percent tariffs on steel and 10 percent tariffs on aluminum, in part to force concessions on other trade issues. Mexican officials said they expected the tariffs to be addressed down the road.

“I don’t think it was necessary to address them now,” Mr. Videgaray said. “We’d like those to be addressed alongside Canada. It would be great if we could have a trilateral agreement on lifting those and our retaliatory tariffs on U.S. goods.”",www.nytimes.com,left,k4fOJwlEacTnqZi6
