topic,source,bias,url,title,date,authors,content,content_original,source_url,bias_text,ID
trade,BBC News,1,https://www.bbc.com/news/business-46465768,Huawei arrest: China demands release of Meng Wanzhou,,,"China is demanding the release of telecoms giant Huawei 's chief financial officer , who has been detained in Canada .
Meng Wanzhou , the daughter of the company 's founder , could face extradition to the US .
She was arrested in Vancouver on 1 December , but the news was not made public at her request .
The charges remain unknown but the US has been probing Huawei over possible violation of sanctions against Iran .
Ms Meng has sought a publication ban on the details of the arrest , which has been granted by the courts .
Huawei said it was `` not aware of any wrongdoing by Ms Meng '' .
Huawei is one of the largest telecommunications equipment and services providers in the world , recently passing Apple to become the second-biggest smartphone maker after Samsung .
European shares hit a two-year low and indexes across Asia dropped sharply following the arrest , which analysts said revived worries over the US-China trade war .
A Chinese foreign ministry spokesperson told reporters : `` The detention without giving any reason violates a person 's human rights . ''
`` We have made solemn representations to Canada and the US , demanding that both parties immediately clarify the reasons for the detention , and immediately release the detainee to protect the person 's legal rights . ''
Beijing has itself frequently been accused by rights groups of rights abuses including unexplained detentions .
However , concerns the arrest would affect the 90-day tariff truce negotiated between the two nations at the G20 have not yet materialised . China announced in a regular press briefing on Thursday that it would `` immediately '' implement the measures agreed .
It also coincides with moves to restrict the use of Huawei technology in Western countries . The US , Australia and New Zealand have blocked the use of the Chinese firm 's equipment in infrastructure for new faster 5G mobile networks .
Canada 's ministry of justice said a bail hearing for Ms Meng had been set for Friday .
It is hard to overstate the symbolism and significance of this event . Huawei is the crown jewel of Chinese tech and Ms Meng is effectively its princess .
Even though it 's still not clear what the charges against her are , this is not simply a case about the arrest of one woman , or just one company .
This arrest could materially damage the relationship between the US and China at possibly one of the most sensitive times between the two countries in their long and torrid history .
The gloves are off . Things have taken a dramatic turn for the worse .
US media reported that Huawei is under investigation for potential violations of US sanctions against Iran .
One report in the New York Times said the US commerce and treasury departments had subpoenaed the firm over suspected violation of sanctions against both Iran and North Korea .
US lawmakers have repeatedly accused the company of being a threat to US national security , arguing that its technology could be used for spying by the Chinese government .
Meanwhile , US National Security Adviser John Bolton said on Thursday that he had known in advance about Ms Meng 's arrest .
He told National Public Radio that he did n't know if President Donald Trump had also been aware .
In a statement , Huawei said it had complied with `` all applicable laws and regulations where it operates , including applicable export control and sanction laws and regulations of the UN , US and EU . ''
The arrest is a top trending topic on Chinese social media , BBC Monitoring says , with many users criticising the US and Canada for what they call `` low '' and `` bullying '' tactics .
Some Western governments fear Beijing will gain access to fifth-generation ( 5G ) mobile and other communications networks through Huawei and expand its spying ability , although the firm insists there is no government control .
The US has brought a number of legal cases against Chinese technology firms , with accusations such as cyber-security theft and violations of Iran sanctions .
Donald Trump last month reinstated all the US sanctions on Iran that had been removed under a 2015 nuclear deal .
Mr Trump had been fiercely opposed to the deal , which saw Iran limit its controversial nuclear activities in exchange for sanctions relief .","Image copyright Reuters Image caption Meng Wanzhou was detained while transferring between flights in Vancouver

China is demanding the release of telecoms giant Huawei's chief financial officer, who has been detained in Canada.

Meng Wanzhou, the daughter of the company's founder, could face extradition to the US.

She was arrested in Vancouver on 1 December, but the news was not made public at her request.

The charges remain unknown but the US has been probing Huawei over possible violation of sanctions against Iran.

China says her detention is possibly a rights abuse.

Ms Meng has sought a publication ban on the details of the arrest, which has been granted by the courts.

Huawei said it was ""not aware of any wrongdoing by Ms Meng"".

Huawei is one of the largest telecommunications equipment and services providers in the world, recently passing Apple to become the second-biggest smartphone maker after Samsung.

European shares hit a two-year low and indexes across Asia dropped sharply following the arrest, which analysts said revived worries over the US-China trade war.

How has China responded?

A Chinese foreign ministry spokesperson told reporters: ""The detention without giving any reason violates a person's human rights.""

""We have made solemn representations to Canada and the US, demanding that both parties immediately clarify the reasons for the detention, and immediately release the detainee to protect the person's legal rights.""

Beijing has itself frequently been accused by rights groups of rights abuses including unexplained detentions.

Image copyright Getty Images Image caption Huawei is one of the largest telecommunications equipment and services providers in the world

However, concerns the arrest would affect the 90-day tariff truce negotiated between the two nations at the G20 have not yet materialised. China announced in a regular press briefing on Thursday that it would ""immediately"" implement the measures agreed.

It also coincides with moves to restrict the use of Huawei technology in Western countries. The US, Australia and New Zealand have blocked the use of the Chinese firm's equipment in infrastructure for new faster 5G mobile networks.

Canada's ministry of justice said a bail hearing for Ms Meng had been set for Friday.

The gloves are off

By Karishma Vaswani, BBC Asia Business Correspondent

It is hard to overstate the symbolism and significance of this event. Huawei is the crown jewel of Chinese tech and Ms Meng is effectively its princess.

Even though it's still not clear what the charges against her are, this is not simply a case about the arrest of one woman, or just one company.

This arrest could materially damage the relationship between the US and China at possibly one of the most sensitive times between the two countries in their long and torrid history.

The gloves are off. Things have taken a dramatic turn for the worse.

What could be behind it?

US media reported that Huawei is under investigation for potential violations of US sanctions against Iran.

One report in the New York Times said the US commerce and treasury departments had subpoenaed the firm over suspected violation of sanctions against both Iran and North Korea.

US lawmakers have repeatedly accused the company of being a threat to US national security, arguing that its technology could be used for spying by the Chinese government.

Meanwhile, US National Security Adviser John Bolton said on Thursday that he had known in advance about Ms Meng's arrest.

He told National Public Radio that he didn't know if President Donald Trump had also been aware.

In a statement, Huawei said it had complied with ""all applicable laws and regulations where it operates, including applicable export control and sanction laws and regulations of the UN, US and EU.""

The arrest is a top trending topic on Chinese social media, BBC Monitoring says, with many users criticising the US and Canada for what they call ""low"" and ""bullying"" tactics.

Why is Huawei a concern to the West?

Some Western governments fear Beijing will gain access to fifth-generation (5G) mobile and other communications networks through Huawei and expand its spying ability, although the firm insists there is no government control.

Image copyright Reuters Image caption Meng Wanzhou was pictured with Russian President Vladimir Putin at a 2014 investment event in Moscow

The US has brought a number of legal cases against Chinese technology firms, with accusations such as cyber-security theft and violations of Iran sanctions.

Donald Trump last month reinstated all the US sanctions on Iran that had been removed under a 2015 nuclear deal.

Mr Trump had been fiercely opposed to the deal, which saw Iran limit its controversial nuclear activities in exchange for sanctions relief.",www.bbc.com,center,cTi4c2jFjRfSqR8L
trade,NPR Online News,1,http://www.npr.org/sections/itsallpolitics/2015/05/26/408832953/just-how-big-is-the-asia-trade-deal-obama-wants-its-a-beast,Just How Big Is The Asia Trade Deal Obama Wants? It's A Beast,2015-05-26,Danielle Kurtzleben,"Just How Big Is The Asia Trade Deal Obama Wants ? It 's A Beast
One of the most basic facts about the Trans-Pacific Partnership is also the most important : It 's huge .
The trade deal got over a big hurdle Friday when the Senate voted in favor of giving the Obama administration `` fast-track '' authority to negotiate the deal with Canada and 10 Asian nations .
That leaves the U.S. House , and it 's unclear it has the votes yet . If it passes , though , TPP , which has angered many in the president 's party , would be by far the largest free trade agreement the U.S. has in effect .
The 12 nations involved in TPP make up about 36 percent of global gross domestic product , or GDP , according to data from the International Monetary Fund . That sets the TPP well apart from the 14 free trade agreements the U.S. currently has in effect with 20 countries ( to be fair , the U.S. accounts for nearly 23 percent of global GDP by itself ) .
Not only that , but these nations together account for about one-third of global trade , according to the Brookings Institution .
So the TPP stands apart from other trade agreements in its size . But that 's only one dimension of its impact . Another way the TPP is gargantuan is tougher to quantify in a bar graph : its scope . It not only covers basic trade issues like tariffs , but also a variety of other areas like labor and environmental and intellectual property .
Politics White House Pushes For Fast-Track Trade Authority White House Pushes For Fast-Track Trade Authority Listen · 2:55 2:55
The size and scope of TPP matter because they are at the center of the debate . The Obama administration sees the deal 's broad reach as positive — the agreement , the administration says , will open up the U.S. to all kinds of new markets and business .
Agribusiness companies , for example , are excited about having new avenues for their products . The labor and environmental provisions , the administration also argues , will force other nations to up their game on those issues , `` leveling the playing field . ''
Not only that , but the TPP 's size is all the more important for the one economic superpower that is n't included in it : China . One of the administration 's top arguments for the deal is that in negotiating TPP , it `` writes the rules '' for trade with a large swath of eastern Asian countries before China can with its own trade agreements .
But opponents , like Sen. Elizabeth Warren , D-Mass. , worry about the sweep of the deal . Leaked chapters have intellectual property advocates , like the Electronic Frontier Foundation , worried it goes too far in areas like extending copyright laws and fair use rules . Doctors Without Borders has also argued the deal could make for more expensive generic drugs , restricting access to medicine for some consumers .
However , some wish the pact went further — environmental groups like the Sierra Club , for example , believe the provisions wo n't do enough to address overfishing .
But then , no one outside members of Congress , negotiators and a small group of cleared individuals has access to the pact , so it 's hard to know exactly how far it will ( or wo n't ) go . And that is perhaps the source of the most tension in the TPP debate : that such a big deal is being negotiated behind closed doors .
If Congress grants the administration fast-track ( also known as Trade Promotion Authority ) , it will mean two to four months for public comment before Congress gives the deal an up-or-down vote , with no amendments or debate .
The administration argues that this is unprecedented transparency for a trade deal . Opponents , however , believe it would be too little , too late in what has now been a seven-year negotiating process .","Just How Big Is The Asia Trade Deal Obama Wants? It's A Beast

Enlarge this image toggle caption Yoshikazu Tsuno/AFP/Getty Images Yoshikazu Tsuno/AFP/Getty Images

One of the most basic facts about the Trans-Pacific Partnership is also the most important: It's huge.

The trade deal got over a big hurdle Friday when the Senate voted in favor of giving the Obama administration ""fast-track"" authority to negotiate the deal with Canada and 10 Asian nations.

That leaves the U.S. House, and it's unclear it has the votes yet. If it passes, though, TPP, which has angered many in the president's party, would be by far the largest free trade agreement the U.S. has in effect.

The 12 nations involved in TPP make up about 36 percent of global gross domestic product, or GDP, according to data from the International Monetary Fund. That sets the TPP well apart from the 14 free trade agreements the U.S. currently has in effect with 20 countries (to be fair, the U.S. accounts for nearly 23 percent of global GDP by itself).

Not only that, but these nations together account for about one-third of global trade, according to the Brookings Institution.

So the TPP stands apart from other trade agreements in its size. But that's only one dimension of its impact. Another way the TPP is gargantuan is tougher to quantify in a bar graph: its scope. It not only covers basic trade issues like tariffs, but also a variety of other areas like labor and environmental and intellectual property.

Politics White House Pushes For Fast-Track Trade Authority White House Pushes For Fast-Track Trade Authority Listen · 2:55 2:55

The size and scope of TPP matter because they are at the center of the debate. The Obama administration sees the deal's broad reach as positive — the agreement, the administration says, will open up the U.S. to all kinds of new markets and business.

Agribusiness companies, for example, are excited about having new avenues for their products. The labor and environmental provisions, the administration also argues, will force other nations to up their game on those issues, ""leveling the playing field.""

Not only that, but the TPP's size is all the more important for the one economic superpower that isn't included in it: China. One of the administration's top arguments for the deal is that in negotiating TPP, it ""writes the rules"" for trade with a large swath of eastern Asian countries before China can with its own trade agreements.

But opponents, like Sen. Elizabeth Warren, D-Mass., worry about the sweep of the deal. Leaked chapters have intellectual property advocates, like the Electronic Frontier Foundation, worried it goes too far in areas like extending copyright laws and fair use rules. Doctors Without Borders has also argued the deal could make for more expensive generic drugs, restricting access to medicine for some consumers.

However, some wish the pact went further — environmental groups like the Sierra Club, for example, believe the provisions won't do enough to address overfishing.

But then, no one outside members of Congress, negotiators and a small group of cleared individuals has access to the pact, so it's hard to know exactly how far it will (or won't) go. And that is perhaps the source of the most tension in the TPP debate: that such a big deal is being negotiated behind closed doors.

If Congress grants the administration fast-track (also known as Trade Promotion Authority), it will mean two to four months for public comment before Congress gives the deal an up-or-down vote, with no amendments or debate.

The administration argues that this is unprecedented transparency for a trade deal. Opponents, however, believe it would be too little, too late in what has now been a seven-year negotiating process.",www.npr.org,center,ZJuKWj1WJEZ2Uzml
trade,New York Times - News,0,https://www.nytimes.com/2020/01/15/business/china-technology-transfer.html,How China Obtains American Trade Secrets,2020-01-15,Keith Bradsher,"Companies are loath to accuse Chinese partners of theft for fear of getting punished . Business groups that represent them say Chinese companies use those corporate ties to pressure foreign partners into giving up secrets . They also say Chinese officials have pressured foreign companies to give them access to sensitive technology as part of a review process to make sure those products are safe for Chinese consumers .
Foreign business groups point to renewable energy as one area where China used some of these tactics to build homegrown industries .
Gamesa of Spain was the wind turbine market leader in China when Beijing mandated in 2005 that 70 percent of each wind turbine installed in China had to be manufactured inside the country . The company trained more than 500 suppliers in China to manufacture practically every part in its turbines . It set up a plant to assemble them in the city of Tianjin . Other multinational wind turbine manufacturers did the same .
The Obama administration questioned the policy as a violation of World Trade Organization rules and China withdrew it , but by then it was too late . Chinese state-controlled enterprises had begun to assemble turbines using the same suppliers . China is now the world ’ s biggest market for wind turbines , and they are mostly made by Chinese companies .
A somewhat similar industrial evolution occurred soon after in solar energy . China required that its first big municipal solar project only use solar panels that were at least 80 percent made in China . Companies rushed to produce in China and share technology .
The Chinese government also heavily subsidized the manufacture of solar panels , mostly for export . Chinese companies ended up producing most of the world ’ s solar panels .
Some in the Trump administration fear the same thing is happening in cars .
Shortly after opening China to foreign auto companies , Chinese officials held a competition among global automakers for who would be allowed to enter the market . The competition included a detailed review of each company ’ s offer to transfer technology to a joint venture to be formed with a Chinese state-owned partner .","Companies are loath to accuse Chinese partners of theft for fear of getting punished. Business groups that represent them say Chinese companies use those corporate ties to pressure foreign partners into giving up secrets. They also say Chinese officials have pressured foreign companies to give them access to sensitive technology as part of a review process to make sure those products are safe for Chinese consumers.

Do the methods work?

Foreign business groups point to renewable energy as one area where China used some of these tactics to build homegrown industries.

Gamesa of Spain was the wind turbine market leader in China when Beijing mandated in 2005 that 70 percent of each wind turbine installed in China had to be manufactured inside the country. The company trained more than 500 suppliers in China to manufacture practically every part in its turbines. It set up a plant to assemble them in the city of Tianjin. Other multinational wind turbine manufacturers did the same.

The Obama administration questioned the policy as a violation of World Trade Organization rules and China withdrew it, but by then it was too late. Chinese state-controlled enterprises had begun to assemble turbines using the same suppliers. China is now the world’s biggest market for wind turbines, and they are mostly made by Chinese companies.

A somewhat similar industrial evolution occurred soon after in solar energy. China required that its first big municipal solar project only use solar panels that were at least 80 percent made in China. Companies rushed to produce in China and share technology.

The Chinese government also heavily subsidized the manufacture of solar panels, mostly for export. Chinese companies ended up producing most of the world’s solar panels.

What industries could be next?

Some in the Trump administration fear the same thing is happening in cars.

Shortly after opening China to foreign auto companies, Chinese officials held a competition among global automakers for who would be allowed to enter the market. The competition included a detailed review of each company’s offer to transfer technology to a joint venture to be formed with a Chinese state-owned partner.",www.nytimes.com,left,92Fd9zy4zlZy0nIc
