topic,source,bias,url,title,date,authors,content,content_original,source_url,bias_text,ID
trade,BBC News,1,https://www.bbc.com/news/business-51956880,Carmakers answer pleas to make medical supplies,,"Justin Harper, Business Reporter","Car firms are answering calls from governments to help make more ventilators and face masks to help out during the coronavirus pandemic .
On Monday , Fiat began converting one of its car plants in China to start making about one million masks a month .
The carmaker wants to start production in the coming weeks , wrote its chief executive Mike Manley in an email .
Other major car firms are looking at ways they can shift manufacturing towards ventilators .
General Motors , Ford and Tesla in the US have all pledged their support to offer resources to make more ventilators , along with Japanese carmaker Nissan and Formula 1 teams in the UK .
Major car plants in the US , Europe and Asia have halted production to try to help prevent the spread of coronavirus .
But they are still pledging to help make ventilators and other vital medical equipment .
Ford on Tuesday said it was working with GE Healthcare and 3M , another health industry manufacturer , to design modified respirators and ventilators , which could be produced using fans , batteries and other parts that Ford typically uses for its cars .
The firms said they did not have a set timeline for delivery of the products .
However , Ford has already started making transparent face shields , to complement existing protective gear for hospital staff , with the first 1,000 set for delivery at three Detroit-area hospitals this week .
It expects to produce about 75,000 of such shields this week .
US President Donald Trump tweeted on Sunday : `` Ford , General Motors and Tesla are being given the go ahead to make ventilators and other metal products , FAST ! Go for it auto execs , let 's see how good you are ? ''
It came after the US Food and Drug Administration ( FDA ) announced that it had reduced barriers in the medical device approval process to help speed up the production of ventilators .
`` Medical device makers can more easily make changes to existing products , such as changes to suppliers or materials , to help address current manufacturing limitations or supply shortages , '' US Health and Human Services Secretary Alex Azar said in a statement .
`` Other manufacturers , such as auto makers , can more easily repurpose production lines to help increase supply . ''
However , some experts have warned that carmakers may not find it easy to switch production .
Jens Hallek , head of ventilator manufacturer Hamilton Medical , told Wired the materials and the components needed to build a ventilator are `` highly specific '' and require `` specialised know-how '' .
`` These are extremely sensitive machines with not only a lot of hardware , but also a lot of software . If one of the components does not work correctly , the whole machine shuts down and can not be used any more , '' he said .
Former US Defense Department officials told the Washington Post that it could take more than a year for carmakers or aerospace factories to start making ventilators .
Meanwhile , Tesla boss Elon Musk said he had bought 1,255 ventilators from China and had them shipped to Los Angeles .
Skip Twitter post by @ elonmusk Yup , China had an oversupply , so we bought 1255 FDA-approved ResMed , Philips & Medtronic ventilators on Friday night & airshipped them to LA . If you want a free ventilator installed , please let us know ! — Elon Musk ( @ elonmusk ) March 24 , 2020 Report
Last week , Formula 1 teams in the UK said they hoped to find `` a tangible outcome in the next few days '' to help increase the supply of medical equipment . Working with the government and health authorities , F1 said it had experts in design , technology and production capabilities who could help out .
Nissan is part of a consortium , including sports car firm McLaren and aerospace company Meggitt , looking to develop a new medical ventilator . `` We are fully focused on the project , '' McLaren said in a statement , but warned of the `` limited time and scale of the challenge '' .
Indian billionaire Anand Mahindra said his company , The Mahindra Group , would begin work immediately to explore how its factories could make ventilators . The conglomerate is the world 's largest tractor maker and India 's biggest electric vehicle manufacturer , according its its website .","Media playback is unsupported on your device Media caption The factory switching from race cars to ventilators

Car firms are answering calls from governments to help make more ventilators and face masks to help out during the coronavirus pandemic.

On Monday, Fiat began converting one of its car plants in China to start making about one million masks a month.

The carmaker wants to start production in the coming weeks, wrote its chief executive Mike Manley in an email.

Other major car firms are looking at ways they can shift manufacturing towards ventilators.

General Motors, Ford and Tesla in the US have all pledged their support to offer resources to make more ventilators, along with Japanese carmaker Nissan and Formula 1 teams in the UK.

Major car plants in the US, Europe and Asia have halted production to try to help prevent the spread of coronavirus.

But they are still pledging to help make ventilators and other vital medical equipment.

Ford on Tuesday said it was working with GE Healthcare and 3M, another health industry manufacturer, to design modified respirators and ventilators, which could be produced using fans, batteries and other parts that Ford typically uses for its cars.

The firms said they did not have a set timeline for delivery of the products.

However, Ford has already started making transparent face shields, to complement existing protective gear for hospital staff, with the first 1,000 set for delivery at three Detroit-area hospitals this week.

It expects to produce about 75,000 of such shields this week.

US President Donald Trump tweeted on Sunday: ""Ford, General Motors and Tesla are being given the go ahead to make ventilators and other metal products, FAST! Go for it auto execs, let's see how good you are?""

It came after the US Food and Drug Administration (FDA) announced that it had reduced barriers in the medical device approval process to help speed up the production of ventilators.

""Medical device makers can more easily make changes to existing products, such as changes to suppliers or materials, to help address current manufacturing limitations or supply shortages,"" US Health and Human Services Secretary Alex Azar said in a statement.

""Other manufacturers, such as auto makers, can more easily repurpose production lines to help increase supply.""

However, some experts have warned that carmakers may not find it easy to switch production.

Jens Hallek, head of ventilator manufacturer Hamilton Medical, told Wired the materials and the components needed to build a ventilator are ""highly specific"" and require ""specialised know-how"".

""These are extremely sensitive machines with not only a lot of hardware, but also a lot of software. If one of the components does not work correctly, the whole machine shuts down and cannot be used any more,"" he said.

Former US Defense Department officials told the Washington Post that it could take more than a year for carmakers or aerospace factories to start making ventilators.

Meanwhile, Tesla boss Elon Musk said he had bought 1,255 ventilators from China and had them shipped to Los Angeles.

Skip Twitter post by @elonmusk Yup, China had an oversupply, so we bought 1255 FDA-approved ResMed, Philips & Medtronic ventilators on Friday night & airshipped them to LA. If you want a free ventilator installed, please let us know! — Elon Musk (@elonmusk) March 24, 2020 Report

'Fully focused'

Last week, Formula 1 teams in the UK said they hoped to find ""a tangible outcome in the next few days"" to help increase the supply of medical equipment. Working with the government and health authorities, F1 said it had experts in design, technology and production capabilities who could help out.

Nissan is part of a consortium, including sports car firm McLaren and aerospace company Meggitt, looking to develop a new medical ventilator. ""We are fully focused on the project,"" McLaren said in a statement, but warned of the ""limited time and scale of the challenge"".

Indian billionaire Anand Mahindra said his company, The Mahindra Group, would begin work immediately to explore how its factories could make ventilators. The conglomerate is the world's largest tractor maker and India's biggest electric vehicle manufacturer, according its its website.",www.bbc.com,center,51Ml4E7AG1Ws8piL
